{
  "node": {
    "version": "24",
    "debianImageSuffix": "trixie"
  },
  "rust": {
    "toolchain": "1.95",
    "debianImageSuffix": "trixie"
  },
  "python": {
    "version": "3.12",
    "debianImageSuffix": "trixie-slim"
  },
  "go": {
    "version": "1.24",
    "debianImageSuffix": "trixie"
  },
  "ruby": {
    "version": "3.4",
    "debianImageSuffix": "trixie"
  },
  "java": {
    "version": "21",
    "distribution": "temurin",
    "debianImageSuffix": "trixie"
  },
  "debian": {
    "version": "13",
    "codename": "trixie"
  }
}
